Chapter,Character,Dialogue_Korean,Dialogue_English,Progress,Time,Status
0_1,player,드디어 오늘 첫 출근이네.,,게임시작,,play
0_1,player,떨리긴 하는데 긴장하지 말고 잘 해보자.,,,,play
0_1,player,이제 병원으로 가야겠다.,,,,play
0_2,player,"안녕하세요, Michael 씨.",,집 나온 후,,play
0_2,npc,"좋은 아침일세, 출근하는 건가?",,,,play
0_2,player,"네, 오늘 첫 출근이에요.",,,,play
0_2,npc,"그렇군, 악몽 가이드라고 했지? 힘내게.",,,,play
0_2,player,"네, 감사합니다. 저는 이만 가볼게요. 좋은 하루 보내세요.",,,,play
0_2,npc,"그래, 잘 가게.",,,,play
0_3,player,안녕하세요. 새로 입사한 Steven입니다.,,사무실에 첫 입장,,play
0_3,npc,"어. 반가워, 나는 네 사수인 James야.",,,,play
0_3,npc,첫날부터 미안하지만 인원이 부족해서 오늘부터 바로 임무에 투입될 거야.,,,,play
0_3,npc,어떻게 일을 진행하는 지 알려줄게.,,,,play
0_3,npc,우리는 악몽 속에 갇힌 사람들을 구출하기 위해 정신 연결 기계장치를 사용해 악몽 속으로 들어갈 거야.,,,,play
0_3,npc,그곳에서 악몽의 주인의 요구를 충족시켜 데리고 탈출해야 해.,,,,play
0_3,npc,"하지만 악몽의 내용이 어떤 것인지는 들어가기 전까지는 알 수 없어서, 직접 이유를 찾아야 해.",,,,play
0_3,npc,"기회는 여러 번 주어질 테지만, 네가 정신적으로 지치지 않도록 주의해야 해.",,,,play
0_3,npc,"오늘은 내가 같이 병실까지는 동행할 거야. 하지만, 악몽 안에서는 혼자 모든 걸 해결해야 해.",,,,play
0_3,npc,제대로 이해됐어?,,,,play
0_3,Select,,,,,play
0_3,player,한번만 더 설명 부탁 드립니다. ,,,,play
0_3,player,이해했습니다.,,,,play
0_3,Select,,,,,play
0_3,npc,오늘 네가 구출해야 할 악몽의 주인에 관한 정보야. 확인하고 말을 걸어줘.,,,,play
0_3,npc,"다 확인했어? 그럼 이제 출발하자, 환자도 중요하지만 네 정신도 중요하다는 걸 명심해.",,,,play
0_4,npc,안녕하세요. 처음 뵙겠습니다. 악몽 가이드인 James 입니다.,,병실 입장,,play
0_4,npc,안녕하세요..,,,,play
0_4,npc,오늘 아드님은 이 친구가 구출해 낼 것입니다.,,,,play
0_4,player,안녕하세요. 처음 뵙겠습니다. Steven 입니다.,,,,play
0_4,npc,전 바로 준비를 하겠습니다.  조금만 기다리고 있어.,,,,play
0_4,npc,제발 제 아들 좀 구해주세요.. 정말 착한 아이예요…,,,,play
0_4,player,걱정 마세요. 제가 꼭 아드님을 구출하겠습니다.,,,,play
0_4,npc,"Steven, 이제 준비됐어. 바로 시작하자.",,,,play
0_4,player,"네, 알겠습니다.",,,,play
1_0,player,신기하네. 내가 정말 악몽 속으로 들어오다니.,,악몽진입,,play
1_0,player,"여긴 학교인 거 같네, 그리고 생각보다 밝네.",,,,play
1_0,player,학교에서 무슨 일이 있었던 걸까?,,,,play
1_0,player,일단 악몽의 이유를 알 수 있는 단서가 있는지 둘러봐야겠어.,,,,play
1_1,npc,흐흑..,,피해자발견,,play
1_1,player,Ethan? 캐비닛 안에서 뭐해? 이거 좀 열어줄래?,,,,play
1_1,npc,누구세요?..,,,,play
1_1,player,너를 도와주러 온 사람이야. 네 부모님이 보내셨어.,,,,play
1_1,npc,제 부모님이요?..,,,,play
1_1,player,"응, 네 부모님이 많이 걱정하고 계셔.",,,,play
1_1,player,이만 여기서 나가자.,,,,play
1_1,npc,싫어요.. 밖에는 그 녀석(들)이 있다고요.,,,,play
1_1,player,그 녀석들이 누군데?,,,,play
1_1,npc,싫어요. 이만 가주세요.. 전 됐으니까요.,,,,play
1_1,player,하지만.. 일단 알겠어..,,,,play
1_1,Select,,,,,play
1_1,player,일단 캐비닛의 열쇠를 찾아야겠어. 교무실,,,,play
1_1,player,관리실로 가보자.,,,,play
1_1,Select,,,,,play
1_2,player,이건.. 더러워진 옷이네.. 발자국도 있어.,,락커 발견,,play
1_2,player,무슨 일이 있었던 걸까?.. 설마?..,,,,play
1_3,player,"저기 열쇠 보관함이 있어, 저기에 열쇠가 있을 거야.",,교무실_관리실 도착,,play
1_4,player,"뭐야, 무슨 일이지?",,열쇠 획득,,play
1_5,player,저건… 뭐지? 사람인가?,,몬스터 첫 등장,,play
1_5,monster,Ethan?.. 거기 너야??,,,,play
1_5,monster,어디 갔었어?? 한참 찾았잖아.,,,,play
1_5,monster,우리 같이 놀기로 했었잖아!!,,,,play
1_6,player,"Ethan, 빨리 여기서 탈출해야 해!! ",,열쇠 획득 후 피해자와 재회,,play
1_6,player,"뭐야, 왜 안 열려!",,,,play
1_6,player,"이런, 일단 나도 저 캐비닛에 숨어야겠다.",,,,play
1_6,monster,이런 또 놓쳤나?..,,,,play
1_6,monster,"뭐, 숨바꼭질은 재미있으니까 ㅋㅋ",,,,play
1_7,player,"운 좋게 따돌린 거 같네.. Ethan, 괜찮아?",,몬스터 후퇴,,play
1_7,npc,저는 됐으니까.. 제발 그냥 가주세요..,,,,play
1_7,player,혹시 무슨 일이 있었는지 만이라도 얘기해 줄 수 없을까?..,,,,play
1_7,npc,제발 그냥 가주세요.. 제발..,,,,play
1_7,player,알겠어.. 나는 네 편이라는 것만 기억해줘..,,,,play
1_7,player,(먼저 Ethan 이 무슨 일을 겪었는지 알아내야겠어.),,,,play
1_8,player,"뭐야, 내가 있었던 곳이 아니잖아.",,공간 변경,,play
1_8,player,악몽 속이라서 그런가..,,,,play
1_8,player,어쩔 수 없지.. 일단 계속 둘러봐야겠어.,,,,play
1_9,player,청 테이프네.,,청 테이프 ,,play
1_9,player,누군가 사용한 거 같아,,,,play
1_10,player,Ethan이랑 대화한 문자가 있네. 확인해 봐야겠어.,,가해자 휴대폰 발견,,play
1_10,animation,,,,,play
1_10,player,"이런, 이 휴대폰의 주인이 Ethan을 괴롭혔나 보네.",,,,play
1_10,player,악몽이 학교인 이유가 있었구나.,,,,play
1_10,player,이제 Ethan을 구해낼 방법만 찾으면 되겠어.,,,,play
1_10,stop,,,,,play
1_10,animation,,,,,play
1_10,monster,여기에 있었구나?,,,,play
